{
  "policy_version": "1.0.0",
  "model": "FOUNDING GOVERNANCE",
  "establishment_basis": "The current user task explicitly authorizes establishing a minimal founding governance mechanism; it does not identify or sign for a human maintainer.",
  "founding_maintainer_role": "Repository-designated OAS founding maintainer",
  "identified_maintainer_reference": null,
  "authoring_authority": "Repository contributors under scoped task authorization",
  "review_authority": "Recorded repository reviewers; every included ID and exact record checksum requires a decision",
  "rc_authority": "Founding maintainer accepts exact source commit, scope and contracts, then explicitly authorizes RC issuance",
  "adoption_authority": "Founding maintainer by a separate final-adoption decision after RC validation",
  "publication_authority": "Maintainer or explicitly delegated release operator, bound to adopted bytes",
  "acceptance_record_path": "standards/oas/closure/founding-acceptance.json",
  "external_consensus_claim": false,
  "multi_party_migration": "Version the governance policy and record transfer of roles/procedure prospectively; retain all historical pins, decisions and requirement meanings."
}
